{
  "schema_version": 4,
  "video": {
    "video_id": "OlurWhrOsLs",
    "title": "[상품지식] 1만원으로 투자 시작하는 5가지 방법 (for.완전초보)",
    "watch_url": "https://www.youtube.com/watch?v=OlurWhrOsLs",
    "published_at": "2019-09-13",
    "content_type": "Long-form",
    "duration_seconds": 640
  },
  "status": "DRAFT",
  "stage": "VERIFIED",
  "sources": [
    {
      "source_id": "speech",
      "kind": "YOUTUBE_TRANSCRIPT",
      "url": "https://www.youtube.com/watch?v=OlurWhrOsLs",
      "retrieved_at": "2026-10-08",
      "coverage": "FULL",
      "language": "ko",
      "limitations": [
        "Firecrawl Alexandria youtube/read 자동 전사; 초기 도입부터 마지막 인사까지 텍스트 반환",
        "오디오와 원문을 독립 대조하지 않아 전사 완전성은 확정하지 못함",
        "만원/이만원 혼용, 회사명·상품명·가격·종목코드 다수 인식 오류",
        "제공된 전사에 문장별 타임스탬프 없음"
      ]
    },
    {
      "source_id": "meta",
      "kind": "VIDEO_METADATA",
      "url": "https://www.youtube.com/watch?v=OlurWhrOsLs",
      "retrieved_at": "2026-10-08",
      "coverage": "FULL",
      "language": "ko",
      "limitations": [
        "영상 공개 메타데이터. 과거 영상 설명이 이후 수정됐을 가능성 있음"
      ]
    },
    {
      "source_id": "video_frames",
      "kind": "VIDEO_FRAME",
      "url": "https://www.youtube.com/watch?v=OlurWhrOsLs",
      "retrieved_at": "2026-10-09",
      "coverage": "PARTIAL",
      "language": "ko",
      "limitations": [
        "YouTube 자체 스토리보드 제공 5초 간격 129개 시점(0~약 640초)의 저해상도 장면을 검토함",
        "실제 영상 재생 프레임으로 2019년 화면 05:38 미래에셋대우 7,520원, 04:31 삼성전자 27%, 07:26 채권 종류, 08:54 KINDEX 베트남VN30 13,505원 확인",
        "샘플 프레임 및 스토리보드는 전체 영상 프레임 연속검토와 동등하지 않음",
        "프레임 시점은 정확한 화면 표시 시각이고 전사 개별 문장의 정확한 발언 시각은 아님",
        "영상 자체 장면은 외부 이미지로 공개 복제하지 않고 watch_url의 해당 시점으로 참조"
      ]
    },
    {
      "source_id": "krx_etf",
      "kind": "OFFICIAL_DOCUMENT",
      "url": "https://www.krx.co.kr/contents/OPN/01/01030203/OPN01030203T1.jsp",
      "retrieved_at": "2026-10-09",
      "coverage": "PARTIAL",
      "language": "ko",
      "limitations": [
        "KRX NAV/ETF시장가격 괴리율 설명",
        "2026-10-09 현재 공개 자료에서 확인한 범위로 한정; 개별 거래 조건·세후 실효수익을 확정하지 않음"
      ]
    },
    {
      "source_id": "krx_risk",
      "kind": "OFFICIAL_DOCUMENT",
      "url": "https://m.krx.co.kr/contents/06/0609/060901/JHPETP060901M01.jsp",
      "retrieved_at": "2026-10-09",
      "coverage": "PARTIAL",
      "language": "ko",
      "limitations": [
        "KRX ETF 주요 투자위험",
        "2026-10-09 현재 공개 자료에서 확인한 범위로 한정; 개별 거래 조건·세후 실효수익을 확정하지 않음"
      ]
    },
    {
      "source_id": "syfund",
      "kind": "OFFICIAL_DOCUMENT",
      "url": "https://www.syfund.co.kr/fund/search/view/8970",
      "retrieved_at": "2026-10-09",
      "coverage": "PARTIAL",
      "language": "ko",
      "limitations": [
        "신영자산운용 신영밸류고배당 주식형 펀드 공식 상품정보",
        "2026-10-09 현재 공개 자료에서 확인한 범위로 한정; 개별 거래 조건·세후 실효수익을 확정하지 않음"
      ]
    },
    {
      "source_id": "samsung",
      "kind": "OFFICIAL_DOCUMENT",
      "url": "https://www.samsungfund.com/etf/product/list.do",
      "retrieved_at": "2026-10-09",
      "coverage": "PARTIAL",
      "language": "ko",
      "limitations": [
        "삼성자산운용 KODEX 삼성그룹 102780 공식 상품목록",
        "2026-10-09 현재 공개 자료에서 확인한 범위로 한정; 개별 거래 조건·세후 실효수익을 확정하지 않음"
      ]
    },
    {
      "source_id": "ace",
      "kind": "OFFICIAL_DOCUMENT",
      "url": "https://kind.krx.co.kr/disclosure/etfisudetail.do?method=searchEtfIsuSummary&strIsurCd=24571",
      "retrieved_at": "2026-10-09",
      "coverage": "PARTIAL",
      "language": "ko",
      "limitations": [
        "한국거래소 KIND ACE 베트남VN30(합성) 245710",
        "2026-10-09 현재 공개 자료에서 확인한 범위로 한정; 개별 거래 조건·세후 실효수익을 확정하지 않음"
      ]
    },
    {
      "source_id": "mirae",
      "kind": "OFFICIAL_DOCUMENT",
      "url": "https://securities.miraeasset.com/newir/view/pc/kr/about/newsView.jsp?seq=329",
      "retrieved_at": "2026-10-09",
      "coverage": "PARTIAL",
      "language": "ko",
      "limitations": [
        "미래에셋증권 2021년 사명변경 추진 공식보도자료",
        "2026-10-09 현재 공개 자료에서 확인한 범위로 한정; 개별 거래 조건·세후 실효수익을 확정하지 않음"
      ]
    },
    {
      "source_id": "bonds",
      "kind": "OFFICIAL_DOCUMENT",
      "url": "https://www.investor.gov/introduction-investing/investing-basics/investment-products/bonds-or-fixed-income-products/bonds",
      "retrieved_at": "2026-10-09",
      "coverage": "PARTIAL",
      "language": "en",
      "limitations": [
        "미국 SEC 채권의 이자·만기·가격 및 신용위험 교육자료",
        "2026-10-09 현재 공개 자료에서 확인한 범위로 한정; 개별 거래 조건·세후 실효수익을 확정하지 않음"
      ]
    }
  ],
  "claims": [
    {
      "claim_id": "C01",
      "statement": "화자는 초보자가 큰 돈으로 수익률을 최적화하기 전에 적은 비용으로 실제 투자 절차를 익히는 경험 자체에 초점을 맞추라고 설명한다.",
      "claim_type": "EDUCATIONAL_PRINCIPLE",
      "evidence": [
        {
          "source_id": "speech",
          "start_seconds": null,
          "end_seconds": null,
          "excerpt": null,
          "limitations": [
            "전사는 타임코드를 제공하지 않음",
            "도입부: 실전 경험과 수익률보다 학습을 강조",
            "화면 검토 전"
          ]
        },
        {
          "source_id": "video_frames",
          "start_seconds": 110,
          "end_seconds": 110,
          "excerpt": null,
          "limitations": [
            "화면 근거: 소액 투자 학습 강조 영상",
            "발언 타임코드가 아니라 실제 프레임/5초 스토리보드 장면의 시점임"
          ]
        }
      ],
      "conditions": [
        "소액 실습은 교육용이며 매수 추천이 아님"
      ],
      "risks": [
        "거래수수료, 매매 습관 형성, 실제 손실 가능성"
      ],
      "time_scope": {
        "sensitivity": "EVERGREEN",
        "as_of": "2019-09-13",
        "valid_from": null,
        "valid_until": null
      },
      "verification": {
        "status": "CONTEXT_CHECKED",
        "checked_at": "2026-10-09",
        "official_source_ids": [],
        "notes": "영상 전사와 스토리보드의 교육목적 발언 및 영상 공식 설명을 확인. 화자 교육원칙을 법적 효력이나 수익률 보장으로 간주하지 않음."
      }
    },
    {
      "claim_id": "C02",
      "statement": "영상은 소액 실습 대상으로 주식형 공모펀드, 국내 그룹주 ETF, 개별 상장주식, 회사채, 국내상장 해외주식 ETF라는 서로 다른 투자 형태 다섯 가지를 구분한다.",
      "claim_type": "HISTORICAL_FACT",
      "evidence": [
        {
          "source_id": "speech",
          "start_seconds": null,
          "end_seconds": null,
          "excerpt": null,
          "limitations": [
            "전사는 타임코드를 제공하지 않음",
            "본론 초반: 다섯 가지 투자수단을 연속으로 소개",
            "화면 검토 전"
          ]
        },
        {
          "source_id": "video_frames",
          "start_seconds": 120,
          "end_seconds": 120,
          "excerpt": null,
          "limitations": [
            "화면 근거: 다섯 투자수단 안내 자막",
            "발언 타임코드가 아니라 실제 프레임/5초 스토리보드 장면의 시점임"
          ]
        }
      ],
      "conditions": [
        "2019년의 예시로 당시 매수 가능/가격 조건을 전제"
      ],
      "risks": [
        "예시 상품 현재 존속·상장·최소매수단위 확인 불가"
      ],
      "time_scope": {
        "sensitivity": "HISTORICAL",
        "as_of": "2019-09-13",
        "valid_from": null,
        "valid_until": null
      },
      "verification": {
        "status": "CONTEXT_CHECKED",
        "checked_at": "2026-10-09",
        "official_source_ids": [
          "syfund",
          "samsung",
          "ace",
          "mirae"
        ],
        "notes": "영상에 5종 예시(주식형 펀드·삼성그룹 ETF·미래에셋대우 주식·대한항공 회사채·베트남 ETF)가 등장함을 원문/장면으로 확인. 현재 공식 1차자료로 펀드, 삼성그룹 ETF 102780, ACE 베트남 VN30 245710 및 미래에셋대우 사명변경 사실을 확인. 2019년 특정 대한항공 채권의 채권번호·만기·현재 유통여부는 확인되지 않아 현재 매수 후보로 인정하지 않음."
      }
    },
    {
      "claim_id": "C03",
      "statement": "영상에서 펀드는 운용에 맡기는 구조이고 ETF는 여러 종목을 묶은 상품을 주식처럼 거래하는 구조라고 소개한다.",
      "claim_type": "EDUCATIONAL_PRINCIPLE",
      "evidence": [
        {
          "source_id": "speech",
          "start_seconds": null,
          "end_seconds": null,
          "excerpt": null,
          "limitations": [
            "전사는 타임코드를 제공하지 않음",
            "첫 번째 펀드 예시와 두 번째 ETF 예시 설명",
            "화면 검토 전"
          ]
        },
        {
          "source_id": "video_frames",
          "start_seconds": 200,
          "end_seconds": 200,
          "excerpt": null,
          "limitations": [
            "화면 근거: 펀드 주문 화면",
            "발언 타임코드가 아니라 실제 프레임/5초 스토리보드 장면의 시점임"
          ]
        },
        {
          "source_id": "video_frames",
          "start_seconds": 250,
          "end_seconds": 250,
          "excerpt": null,
          "limitations": [
            "화면 근거: ETF 개념 및 시장화면",
            "발언 타임코드가 아니라 실제 프레임/5초 스토리보드 장면의 시점임"
          ]
        }
      ],
      "conditions": [
        "ETF의 지수·보유자산·분산 정도는 상품별로 다름"
      ],
      "risks": [
        "그룹주 ETF는 기업군 집중 위험 존재",
        "펀드 종류에 따른 보수·환매비용 차이"
      ],
      "time_scope": {
        "sensitivity": "EVERGREEN",
        "as_of": "2019-09-13",
        "valid_from": null,
        "valid_until": null
      },
      "verification": {
        "status": "PRIMARY_CONFIRMED",
        "checked_at": "2026-10-09",
        "official_source_ids": [
          "krx_etf",
          "krx_risk",
          "syfund"
        ],
        "notes": "KRX ETF 가격/NAV·추적오차 및 투자위험 자료로 ETF 구조를 확인. 신영자산운용 공식 페이지로 원본의 배당주 주식형 펀드가 실제 별도 운용 상품임을 확인. 특정 펀드/ETF가 무조건 분산되고 안전하다는 의미는 아님."
      }
    },
    {
      "claim_id": "C04",
      "statement": "영상은 개별주식의 한 주 가격만으로 기업의 규모를 추정해서는 안 된다는 설명을 소액 주식매수 사례와 연결한다.",
      "claim_type": "EDUCATIONAL_PRINCIPLE",
      "evidence": [
        {
          "source_id": "speech",
          "start_seconds": null,
          "end_seconds": null,
          "excerpt": null,
          "limitations": [
            "전사는 타임코드를 제공하지 않음",
            "세 번째 주식 사례에서 시가총액과 주당 가격 관계를 논의",
            "화면 검토 전"
          ]
        },
        {
          "source_id": "video_frames",
          "start_seconds": 335,
          "end_seconds": 335,
          "excerpt": null,
          "limitations": [
            "화면 근거: 미래에셋대우 1주 7,520원 (2019.09.11) 화면",
            "발언 타임코드가 아니라 실제 프레임/5초 스토리보드 장면의 시점임"
          ]
        }
      ],
      "conditions": [
        "기업가치 비교에는 주식수·시가총액·현금흐름 등 별도 데이터 필요"
      ],
      "risks": [
        "역사적 종목명·배당·가격 예시는 현재가 아님"
      ],
      "time_scope": {
        "sensitivity": "EVERGREEN",
        "as_of": "2019-09-13",